title,link,published,source,company
"How FERC’s Large-Load Interconnection Actions Help Address Grid Stress, Improve Affordability",https://blogs.nvidia.com/blog/ferc-large-load-interconnection/,"Thu, 18 Jun 2026 20:00:27 GMT",NVIDIA,
"At Cannes Lions, NVIDIA Partners Reshape Advertising and Marketing With AI",https://blogs.nvidia.com/blog/nvidia-ai-marketing-advertising-cannes-lions/,"Thu, 18 Jun 2026 13:00:43 GMT",NVIDIA,
Sync and Stream: GeForce NOW Connects to Members’ Game Libraries Across Devices,https://blogs.nvidia.com/blog/geforce-now-thursday-game-stores/,"Thu, 18 Jun 2026 13:00:32 GMT",NVIDIA,
France Advances Europe’s AI Future With NVIDIA Technologies,https://blogs.nvidia.com/blog/france-advances-europes-ai-future/,"Thu, 18 Jun 2026 06:00:59 GMT",NVIDIA,
"Hands Free, AIs Forward: NVIDIA XR AI Brings Agents to AR Glasses",https://blogs.nvidia.com/blog/nvidia-xr-ai/,"Tue, 16 Jun 2026 22:30:41 GMT",NVIDIA,
"Coherent Breaks Ground on Expanded Texas Facility, Scaling AI’s Optical Backbone",https://blogs.nvidia.com/blog/coherent-texas-ai-optical/,"Tue, 16 Jun 2026 22:10:56 GMT",NVIDIA,
HPE AI Factory With NVIDIA Expands for the Era of Agents,https://blogs.nvidia.com/blog/hpe-ai-factory-agentic-enterprise/,"Tue, 16 Jun 2026 16:30:27 GMT",NVIDIA,
"Fastest, Largest, Strongest: NVIDIA Blackwell Sweeps MLPerf Training 6.0",https://blogs.nvidia.com/blog/blackwell-mlperf-training-6-0/,"Tue, 16 Jun 2026 15:00:36 GMT",NVIDIA,
NVIDIA Blackwell Leads on First Agentic AI Infrastructure Benchmark,https://blogs.nvidia.com/blog/nvidia-blackwell-agentperf-artificial-analysis/,"Fri, 12 Jun 2026 21:00:08 GMT",NVIDIA,
NVIDIA Stockholder Meeting Set for June 24; Individuals Can Participate Online,https://nvidianews.nvidia.com/news/nvidia-stockholder-meeting-set-for-june-24-individuals-can-participate-online,"Thu, 11 Jun 2026 21:32:00 GMT",NVIDIA,
Save Big and Play Bigger: GeForce NOW Summer Sale Brings Major Membership Savings,https://blogs.nvidia.com/blog/geforce-now-thursday-summer-sale-2026/,"Thu, 11 Jun 2026 13:00:17 GMT",NVIDIA,
"For Robotaxis, Safety Must Be Built In, Not Bolted On",https://blogs.nvidia.com/blog/halos-os-robotaxi-safety/,"Wed, 10 Jun 2026 19:00:12 GMT",NVIDIA,
NVIDIA Accelerates Google DeepMind’s DiffusionGemma for Local AI,https://blogs.nvidia.com/blog/rtx-ai-garage-local-gemma-diffusion/,"Wed, 10 Jun 2026 16:15:20 GMT",NVIDIA,
NVIDIA Confidential Computing to Help Expand Apple’s Private Cloud Compute,https://blogs.nvidia.com/blog/nvidia-confidential-computing-apple-private-cloud-compute/,"Tue, 09 Jun 2026 22:34:27 GMT",NVIDIA,
How the UK Is Turning Sovereign AI Ambition Into Action With NVIDIA Technologies,https://blogs.nvidia.com/blog/uk-sovereign-ai-advancements/,"Mon, 08 Jun 2026 06:00:57 GMT",NVIDIA,
"NVIDIA and LG Group Build an AI Factory to Advance Physical AI, Mobility and AI Infrastructure",https://blogs.nvidia.com/blog/nvidia-and-lg-group-ai-factory/,"Mon, 08 Jun 2026 03:00:50 GMT",NVIDIA,
NVIDIA and Doosan Group Collaborate to Advance Physical AI and AI Factory Infrastructure,https://blogs.nvidia.com/blog/nvidia-and-doosan-group-physical-ai/,"Sun, 07 Jun 2026 23:00:36 GMT",NVIDIA,
SK Telecom and NVIDIA Build AI Infrastructure to Power Korea’s AI Innovation,https://nvidianews.nvidia.com/news/sk-telecom-ai-infrastructure,"Sun, 07 Jun 2026 23:00:00 GMT",NVIDIA,
NVIDIA and SK hynix Announce Multiyear Technology Partnership to Advance Memory for AI Factories,https://nvidianews.nvidia.com/news/sk-hynix-ai-factory,"Sun, 07 Jun 2026 23:00:00 GMT",NVIDIA,
NAVER Expands AI Infrastructure With NVIDIA to Serve Surging Global AI Demand,https://nvidianews.nvidia.com/news/naver-ai-infrastructure,"Sun, 07 Jun 2026 23:00:00 GMT",NVIDIA,
Google Is Using Nvidia’s Playbook to Build a Rival AI Chip Business - WSJ,https://news.google.com/rss/articles/CBMipgFBVV95cUxQUmFaN3pTeVAxSml4aXpYZlZMdi1tTGtkU3JncjZUR2h2a196eklrVWt1cklqTkh2bWh2VmNMZlgtTTlmZFFqS05rMlF1WG1mYnA4eVg3SGJDQWlDNVdnRDhQZ3dtd3FCMlZPckExSUVKRS1XU1JoQ1Awc3lxYkJkYkZodmJwM1NlcTJONnRHWjF3NmpBM2RFRUs5UkVROGdpd1hac2VR?oc=5,"Fri, 19 Jun 2026 01:09:00 GMT",Google News,
"Nvidia RTX Spark platform is AI workhorse first, gamer's friend second - New Atlas",https://news.google.com/rss/articles/CBMic0FVX3lxTE9ienNpUG1fSHRDbjVPUEhWc3pNdXhqZnF6V1ZRcEM1RnJxNmlIMGFOV25fYzViRU8xWlQ5VHZIemlpQTBxV0tvR2xUc09wdWIxMnhJcjVqVWZDUlBVbWk0UjJYQno4ZXdNalF1Q0NUaVl4UEU?oc=5,"Sat, 20 Jun 2026 01:10:23 GMT",Google News,
Data Centre Valley: Kazakhstan and Firebird sign €8.6B AI agreements with NVIDIA support - Yahoo Finance,https://news.google.com/rss/articles/CBMijgFBVV95cUxONUhTME5ZbFM5V2dfOFowNy11MkRhSEtfc0FtQmljMVF4RVNPOUxBWVNTb1BSeng2dnVzQ2hnbWdVczNiU3c1U0p2cE5LMC1sVDNjb2dlcFIzYzE2ZE5kanpncnBaczQ4VnB1bnN3OVBBRFRGaWJCdy1wQkZ6Nk5mdnQ4V1ZhRkJUR0pYRjlB?oc=5,"Sat, 20 Jun 2026 11:17:06 GMT",Google News,
"Broadcom Holds the Best AI Hand This Side of Nvidia, Thanks to CEO Hock Tan - Barron's",https://news.google.com/rss/articles/CBMifkFVX3lxTE1oZGxtRE1WR092VmZvaTBXaV9ZQnNSYnd1R19wcl9MaEM2WERNdGdXN1ZVNVdyNU41SHJ0TUZ3MmtCVjdTa1FNX09RWGNrTHh4dm94Uk9WdnBkcmN6TnREcDFVanE3YUJlT0VNVm1iTFplUV9CSFJibVRaYk1QZw?oc=5,"Fri, 19 Jun 2026 05:12:51 GMT",Google News,
Nvidia: The AI Champion’s Stock Is Too Cheap to Ignore - Morningstar,https://news.google.com/rss/articles/CBMikwFBVV95cUxPU1V1Z21qaG1vcUhmZUt3Q0p4WUwyMW9ZR1N6X3NkaGF1bXZieFlqOFlTNnFpcHludS14ZXhLaEtVSXF0M0JncnN2cDhtSEVSc1dGSXFtLTVLN0pkWmxxdUlxSnJWdUdzOUdnamJuTWM4NkxPbFZrdVlLSUljRXUzaG1SS1hTbnRaUkNRa1pFb0NvRnM?oc=5,"Wed, 17 Jun 2026 16:37:25 GMT",Google News,
Open-Source NVIDIA NVK Vulkan Driver Now Supports DLSS - Phoronix,https://news.google.com/rss/articles/CBMiZkFVX3lxTE9SZ0I5MmI1XzU3YmRGMU1WeU5Qb3l4MDBMMTNjMG5ONTNiREhsM0NnaUQ1eEpvcExnSV83dnZQeFpFM0d5TVpyNHJvWjJlOGI2R1pZVEE3RVJGLUNra3JRQmJjZDZRQQ?oc=5,"Fri, 19 Jun 2026 20:26:00 GMT",Google News,
Anthropic Has the Template for Fixing Its Mythos Nightmare - Bloomberg.com,https://news.google.com/rss/articles/CBMivgFBVV95cUxPQVNVSTh1dHZMM09UdnBJRFhVSVNHZy02aG10eWU1eGNNZGFUM3VCeHZDUVVuWTBqemU2ZWxVMHhabmFsWDVXaEV4cE5rRXZJUVNCc2sxRW1PYnlabGthQ3VhRUhlTlUyTi1zYUlaUjlDOFhEVHEtLWZYMnNCaVFaaEhqQ0ZHbXBqU1ZwM18xTUp2R0ZVTm9fWnhXcWk1MXlKUHR0WUdXOGhRN1JtLXBvaHlnZVo3MHBIVmpIaEVn?oc=5,"Fri, 19 Jun 2026 04:00:00 GMT",Google News,
NVIDIA AI Introduce SpatialClaw: A Training-Free Agent That Treats Code as the Action Interface for Spatial Reasoning - MarkTechPost,https://news.google.com/rss/articles/CBMi7gFBVV95cUxOcEdtUUFVMDlvZ2xuNk9uYjFIVjF6UVgzU0JYZjlkczllYWRqSXNkWWxuRUZtNTFHeFYxaHZSb0stS29iLXlzcGJGZ2E1eWhES0plQTUyVmFDODV0WDFsbGJ5Yy13U2t2WHBZSFNwQVRRME1uc19oNW82dHJQejRaQkt3a3A3TTZfRDliQ2lmZ3VpeGxiUXEzZl9EQ2RTekR2SlZ4X3dIYXV3VlNhVUxfQVlIVG5qbmFRR2dPM3ZjNTlxUjhVbnV5VVdLd0dCa3VCMlAzaG1nTlFwX183bE5PSENsRURWa2pVY1lsVmdR?oc=5,"Fri, 19 Jun 2026 22:51:59 GMT",Google News,
Tensordyne makes a big bet on log math to beat Nvidia - The Register,https://news.google.com/rss/articles/CBMirAFBVV95cUxOQjdjcWdRXzY1ZTk5UmFvaWZvT1VfZG5DdE1waDZKbkVQUHdJM2ttYVdlN1M3ekV2WFVUdVRBUjBlR1VvWmViaFRmV0l1em5rWFFtR29xejlxM2FqZmFIbWVSenc2OTZyMlp0aWhiTXNCRGdBZTV5UmEtOWxtWlhKY2FNOHlSd2ttZ0dfNWlleXlNMTVjWWdqaGV0akZCVlRvRHVyaXc2WVlFSGdG?oc=5,"Fri, 19 Jun 2026 15:30:00 GMT",Google News,
Amazon hopes to challenge Nvidia more directly by selling its AI chips - TechCrunch,https://news.google.com/rss/articles/CBMiqAFBVV95cUxQQzZoSDM3a1Q1QVlyNzN4YWFrX3Z0V0JTTlFSaTRpdVdFVHhnVU5xaXNudURJRG51Q0drbVlvNkNFTnM0R3BsR0xVZEw3WkRzMW1pcjNlTTQ2WGdVblhMYzNMeGNITnA0ZFNoTEs5RS1HZDFBTXJvZWVTeVZTajZ0MGRuSXhNN2N5bm5qcUM2UC0zU1RTQ0NhR2RfUXNrSjVoSFJGTWtGTk8?oc=5,"Thu, 18 Jun 2026 18:22:13 GMT",Google News,
France Advances Europe’s AI Future With NVIDIA Technologies - NVIDIA Blog,https://news.google.com/rss/articles/CBMickFVX3lxTE5kOUZDLUhhWmxtaXZVVUNCOGl0b2tVa01vWkM2QVBmbV9mUHUyY19mQ21DRkJoVGEzczVDU2FuejZjVTExZ0kyc3pOVWhlZnpjYmUzd2dPVkJLeS1TcVFZMW41TlVBUEJ2aEZhZnRoQy1NQQ?oc=5,"Thu, 18 Jun 2026 06:09:35 GMT",Google News,
Jensen Huang says electricians and plumbers will be needed by the hundreds of thousands - Fortune,https://news.google.com/rss/articles/CBMihAJBVV95cUxPeHZFRGkzMkJERDk3N3RPbU5WY2g5UXdCU1VsNTY3aGlEWV9WU3NtZzM3MnBZdHF5WlBSdEx1M1FRdHlrN241cEZnYXMwUFlwOVJMMUdSU0xDRXN4Sk1RbS10TE10cXJwZ0hpNWZWWEZNQWJ3VEZYVGpaY0hDXzdMdTNHc083Y3o4aXljVUV1cW1BYi0wSWZpUWxuaktjYl9oQklOd3ZZd3h5QklEMFNidEViaUMxSEwwTUh0YUxsV05XZmpSZFhPOUJrcnRfQy1LZHptaDh3WmY4M3FwZHlpV1JpcTNhT3g2VFVSY0ttZWZnX3NQdS04NFM4TUV6ajE1VE1PQQ?oc=5,"Sat, 20 Jun 2026 11:55:00 GMT",Google News,
Prediction: This Will Be Nvidia's Stock Price in 2030 - The Motley Fool,https://news.google.com/rss/articles/CBMimAFBVV95cUxPYUtZSjdOSHdWZnlVbWRzQTBVb0ZfWnpNbUpuN0JDR1B5TlA1VDlPOTBnak5OcmRKWjdiaXBmOGFrUXUwRFpQc3M5ZDZCYm1nSUMzWloydlpyb3dyTkl5c2ZNY3FxNkcyOE5ocWhMdWo4UF9fMmhxVmdKZjlfdXlKVzgxMElvTF8yQ1ptRDZjMlRNNVdZek1RXw?oc=5,"Sat, 20 Jun 2026 09:35:11 GMT",Google News,
Nvidia’s Huang pledges AI will boost manufacturing jobs. A test will come in Texas - AP News,https://news.google.com/rss/articles/CBMiqAFBVV95cUxNV29DNFB5S19MZXh2Y3l6Ry1vVmM3Z3hwdm1nSFlBRDFobmNjSVRORzloTU94SmNjTmpPTk1KNFpYNmhIWjFfcVhCZlg2X2pNb0NYXzV5bFhOdGd0VEM1S0p1VzhId29vTkhER3lnRm9pSXduQkh2VjJxY2h2eFoza0ZzNG9EOEpubWpuRWlhcEFETndvOFUtMkFkTUZYS3k0a0g3cmtxZFo?oc=5,"Tue, 16 Jun 2026 22:06:00 GMT",Google News,
Chipmakers Renew Nerdy Performance Tussle That Nvidia’s Dominance Had Quashed - Bloomberg.com,https://news.google.com/rss/articles/CBMiywFBVV95cUxOdktrN19pWnkwc1RRU0hfcUJEWUlxNzdNV2EtdlJ6VVFTeDlhVUhIRjViNHVlSHhLRjNhLTNQdDhkY0pKQWVELVZ0WWZtTGxGZ3hZeG9PZTFZNmdKUDdxYWIxSnRPdjNzQmx4a2UxU3UyODV2b1pFV1JRekVHcktVenFkUDdzaFpxMjNFSmdSQ2N5YnZVTDdjcXFUczRBS05UXzJ0bW9aXy1OX3oxMnk3cmxXRGhReWp2YUROVm1FeUtaZ0NtbWxiMm90MA?oc=5,"Sat, 20 Jun 2026 09:17:08 GMT",Google News,
Announcing Amazon EC2 G7 instances accelerated by NVIDIA RTX PRO 4500 Blackwell Server Edition GPUs - Amazon Web Services (AWS),https://news.google.com/rss/articles/CBMizgFBVV95cUxNSDZ0UWxqZGxjNjRFRjhJNkJqQk52eUpaT1A0RnFOVDJpUVFFcU91RWdfWHFZYjhRaGRFakdoVVFJWEhOWUlHZDF2YXh3dHJkazhHT3pHcTV3MVVrQW9SaFFtWUpfbldmekY4RUFXcjJJVWhueE9jUGE5a0Exdm5YVjZtLWUyTF9yWmp1U1l2WWwyU1I5V2huYjhlWk4tOTBRT01ieVpLbjN0OU8tWFRwSE56YjdMSWtJSWl1LUFfWkdFU3ZmMmhyNjJVLVV4dw?oc=5,"Thu, 18 Jun 2026 21:22:10 GMT",Google News,
Nvidia Stock Gains as the Chip Maker Looks to Growth Outside the U.S. - Barron's,https://news.google.com/rss/articles/CBMigwFBVV95cUxQZjZLUTVQd1QtY2RQaFVYTzBIMWZBRjJiM3B1WDZPZjBFNUVMVDYzOEMtTjh3NVg1UGp5SVJ1OFo4emtTMmJiRjRDN3hDM1M0SmpEbms2UUg4VV9HcDVjRnFsVVhJdk1ESDhHTkpiY1J6MnF3c2NmMkphaWJkMFZOc0hXZw?oc=5,"Thu, 18 Jun 2026 18:04:00 GMT",Google News,
Nvidia Stock vs. Micron Stock: Wall Street Says Buy One and Sell the Other - Yahoo Finance,https://news.google.com/rss/articles/CBMimAFBVV95cUxPTHdScHppVS1ac3BSQjZzNkJJWWRYWlJoUTBoeG1EQnRLS1NvV2FKN2loQWcwdFVqNWdGTGk4SzNKT1U2SVIzdTBLblFtbnJWdTZGdzRYaVhUUTVVWFU1WHFWUUlRVWpPT0hmT09sNGlqTkVzNGdCM2tiMTd1bGRXbWRodmcwWlc2dEtWZ01taHVSQUZYRkdDOA?oc=5,"Thu, 18 Jun 2026 09:32:00 GMT",Google News,
Build On-Device AI Companions with the NVIDIA ACE Game Agent SDK and Unreal Engine 5 Plugins - NVIDIA Developer,https://news.google.com/rss/articles/CBMixgFBVV95cUxNZmVjU1R0TVFVeTUtSUhQVVBHeHA0R05uZXh3UlQ3Y284VHJuazNVMks5X3Y3VGtaRG5GOHZXUHlJeDdmNlkybzA4YUFFdzBLQTJDOGRkUDNzRU9LWWYxWTA4aElWM1czeV9FblVGZUFwOUJsaXEwU0pfU00xSXlnbEl6bEpGWDFFZ242S1I0eXczYUdaTlAxRFl0Skd6NlVKNlJDZVl2VWxXSXBUVHFaYU9RWEFHeE9rbnU0U3NsTmtCWkJOZlE?oc=5,"Tue, 16 Jun 2026 17:37:32 GMT",Google News,
11 Words From Nvidia CFO Colette Kress That Should Have AMD and Intel Investors Worried - Yahoo Finance,https://news.google.com/rss/articles/CBMilgFBVV95cUxOX3hnbHhYQVo5eXBDSXNyMEFueWwxNjRQcDhlODFUekJNVmxHbGgtSVBWaUIxMXlmcWN1RlNfeVk1ckh6UVo0SWNOOVVtQTBPaTJBNHZBbV9pTDlJcHJrbUsyaFYyVE9rZnVIS3NLX2ZPN3laMmYxTDZyZ2FUaktzbDMxQ2g3SGk0aU5pdWdEX2kySUZXdVE?oc=5,"Thu, 18 Jun 2026 13:40:00 GMT",Google News,
"Hands Free, AIs Forward: NVIDIA XR AI Brings Agents to AR Glasses - NVIDIA Blog",https://news.google.com/rss/articles/CBMiVkFVX3lxTFBydlhJYmhCUjRzTEZoOHhvVUpDZVVxS0JrbVI5Q2gtZDM1Uk5kVVJUT2pfNjhrb2c1OEhNdXhWZWZMSEc3RXNGcTh2OVhOcmJCVUJSS0N3?oc=5,"Tue, 16 Jun 2026 22:36:15 GMT",Google News,
Nvidia Just Raised $25 Billion in Debt. Here's What That Really Tells Investors - Yahoo Finance,https://news.google.com/rss/articles/CBMimgFBVV95cUxQZS1MNHEzT0cwSlVfZ2xhMk45alctaGJ4LWYxb0pQcXVWQ256dEI3d0s1bFlVR05vamJwSkE0YVdPTWtTYmtLNGpRS2FvVlpnR0JpeHBaQ0EwNERhak53WVl2ZHZQN2FwY1Z6MVotRnJpZzhTc0NfR09sS2RpS3Z2SWdKVzNQMEZ4T0dZeUFQNS1ZZDBsSVdUWnF3?oc=5,"Wed, 17 Jun 2026 23:52:00 GMT",Google News,
Sync and Stream: GeForce NOW Connects to Members’ Game Libraries Across Devices - NVIDIA Blog,https://news.google.com/rss/articles/CBMicEFVX3lxTE9xN3ZZQTdxWjhCMkJjVmh0X1lUclJUZnh6aEpvVDNXR1FGbHNhaEZqSzJsZmQwSlhZT1NMdmFhekx2cXhaVHh3eTljWFVJLTRGOThGck5faGNPXzljcWFkZ2NnTzlkb1NpY055WnF2cm8?oc=5,"Thu, 18 Jun 2026 13:04:42 GMT",Google News,
New GeForce Game Ready Driver Released - NVIDIA,https://news.google.com/rss/articles/CBMiiAFBVV95cUxPT0g2SE5aaVJfMzRZZDBhMnJQcVFINzJ4SS1LRXdPaTdtcWlPdWFxWFNsQ0xoZE1DVzhhT2x0aTFWelVUWURLNG5HWXUtSmEtSEYwWnpxNXQ3TGJESGFtb3c4Z3htOFR5ZDlraTl5RGRaQ3lCbzJrZTVkbG8zTEVSR1h0bmlWdmJy?oc=5,"Tue, 16 Jun 2026 13:02:10 GMT",Google News,
"Coherent Breaks Ground on Expanded Texas Facility, Scaling AI’s Optical Backbone - NVIDIA Blog",https://news.google.com/rss/articles/CBMiZ0FVX3lxTE5WS0FoN0tfREdIeXVZQzEtMV9WMEJHSEZWVXl6djF5aHNGMXlBLWt6c3FfUGpSUVRlRk5JY0FRMXA3Vk10TTVETVJ0UGlhQ2s4OFE0MWp1ZnJ6SHZaNDRFa2RpdTVOZWs?oc=5,"Tue, 16 Jun 2026 22:13:42 GMT",Google News,
"Fastest, Largest, Strongest: NVIDIA Blackwell Sweeps MLPerf Training 6.0 - NVIDIA Blog",https://news.google.com/rss/articles/CBMibEFVX3lxTE13U21YTzRLVnFZSE8zS3hqUThVUjN4OThaa2tSdHNwMXFkZms2QXd5ZUJORGQ4MXNKUGtNSURXYUp0RElYLVhtbUo1bHNJZXB6Rnp5VFlJa1dEY2R6VDNtcENpZ2ItX2g5S1JLaw?oc=5,"Tue, 16 Jun 2026 15:24:14 GMT",Google News,
RTX Remix 1.5 Brings New Packaging Workflow & Accessibility Features - NVIDIA,https://news.google.com/rss/articles/CBMifEFVX3lxTE1NOVdkb1MwanIwM1ZCRGpmTUdlbjBxNFVkZlJBNVBMOXBoeTVTZ2I1N1JxTVRrS092SFliNU5qWDFKLUlXTk8tTzlqc1R5SWs1SEZITktpLUMxTFl1amljN3BCZ2h6SE5vaGlVejl2N0pTMFk5bkhvQ1U0a0w?oc=5,"Tue, 16 Jun 2026 13:02:10 GMT",Google News,
"PUBG Ally Duo Mode Two-Week Beta Available Now, Adding A Collaborative AI Teammate To Your Squad - NVIDIA",https://news.google.com/rss/articles/CBMiiwFBVV95cUxOcXNQWjZEeDdMTjNxQmlNMzA2aGRadENHalNRT3ZvYUVaZl9KaGZzTHA5T0hTbTZEWmFrdGNvZFFSYXFGUHg4Z0dSUElyTlJYQy04UWhJazRIX3BsdGMxMFFCTFY1VzdaQ1NRTm1qMkdzbVNpXy0xMkp2YmM5dFF3V3R2a3VoNEFFQkRJ?oc=5,"Wed, 17 Jun 2026 09:21:05 GMT",Google News,
"Dow Jones Futures Fall; Nvidia Leads 5 Stocks Near Buy Points, SpaceX Needs This - Investor's Business Daily",https://news.google.com/rss/articles/CBMitgFBVV95cUxPNEhrdlloWm5pS3hyaVF6azNTZW9TbnJFU01aTmJNems5Tk1ROUl1aGxhY3BfTkZYNlZOMkJtTDRuWXNvcFJEb2FnQ1duY0VOU20zNGIxaXhmcHU1WXMzNTNiYl9IZmZRTzlfT0k5NnA5ejQ1MGJlR21melNMOFVsbVpvc1RzdmdCOWszMnluZ2ctbkY4ajFZZDVsakZTZENyanJjWmozcGhJNDJneTZxU1luT3h2Zw?oc=5,"Sat, 20 Jun 2026 02:47:00 GMT",Google News,
Nvidia’s Biggest Threat Isn’t AMD—It’s Its Own Best Customers - Barron's,https://news.google.com/rss/articles/CBMieEFVX3lxTE1lZjk4U0Z0cWl0U0NPU255Rng2ZlBPOXNENklQVjQzOXZiUk0xckRPbmNBdk5HTmZlUlhMN0VTd0ZCUjdnMGstai1vMDgxVWNJekFPb3d3RHplQ3dMNUtUVE1ueENjTW15TzMwbVFJeS1CUDFuaEp5OQ?oc=5,"Wed, 17 Jun 2026 14:08:00 GMT",Google News,
"Here's How Many Shares of Nvidia You'd Need for $10,000 in Yearly Dividends - The Motley Fool",https://news.google.com/rss/articles/CBMilwFBVV95cUxNM1JnTlV1bFFJZG1PU21PeUZkOFVHNFI1dVI4Rlg3eXNfa1hLYlVLekFMQlRNR2htX01oWUpsSjBvLV9SQTJyNXNSdlFuRktGSzRsM1hjT3hNTDIyWFdJZkx0S0lPQTdPR3kyaWQxZTctNFZiY2tKdGt3MXBCbVF1aG1IanZoRklFaUtFbE1JLWRyOGszME5v?oc=5,"Fri, 19 Jun 2026 14:00:00 GMT",Google News,
"At Cannes Lions, NVIDIA Partners Reshape Advertising and Marketing With AI - NVIDIA Blog",https://news.google.com/rss/articles/CBMigAFBVV95cUxNY21vTjFqU3hZeE5oblVnN0U0eXFzUEo0eWJ3VXhjTVRveXRKNlRPWktWVlV6N1Jvdlh5cW9DajFiRk54VVV1VXY4bDVRUkFsVzhDN2VYa2tqa3BFR1U2dDZOa3dBS1c2Qzg1cFNfZ2tNZmhtVG1MZGdMUjVHbG1FOQ?oc=5,"Thu, 18 Jun 2026 13:04:42 GMT",Google News,
Nvidia plans to raise at least $20 billion in its first debt sale since start of AI boom - CNBC,https://news.google.com/rss/articles/CBMipAFBVV95cUxPSm10ZmNvZWpmMVE3X0NfTS1GbENvZVBBZEo5a3lxYUJHb1U5SDNXWnZ3TnpKN3libzgxdll0cFdzU1I0X1ZtamNNZENRai1SOEFlSFJkYnBqeHJ2UHRGUHpZWFZ5Q0tzNWx5V05GVEhTbzI2cmRRZnNpNEVKRlI4ZkltQVBIMkpqWTZKSzBnNVdVSUlDSktBQ2QwSV9ONHJEQ1JZWNIBqgFBVV95cUxPcmJMMkx1b0tuWlk3OG55WlFKSWMtdGtMRUQxNzBUbWxzWUdkWlNWY3RFUlBZYy0zcWFmSDBOVVczcGFYQVgxSF9UOHNjTFM0a1BrNkJ2dDE3S0cxNUhnSk03MXZvNTJSWEJ1TEp6VkZDSmp3aUNVOTMxOWJtWXQ3YU13WF80OGhvRGg0U3lTdmhCYmtLaE45MDU1NWxVWmZ2clh6SmM5bHJndw?oc=5,"Mon, 15 Jun 2026 19:42:46 GMT",Google News,
NVIDIA and SK hynix Announce Multiyear Technology Partnership to Advance Memory for AI Factories - NVIDIA Newsroom,https://news.google.com/rss/articles/CBMiZEFVX3lxTE9uXzBzR3NhYkhmOFNSb0tua2s2U1RCRHQ5RXpRcUxKS0xMUkFMNlYxMDltR3N3bmVSdWFQc1lMWDcwaC1yVnNnWEdkMEt3QkZOaGZvaXY0cHRHMVBaLUp1SzFDejc?oc=5,"Sun, 07 Jun 2026 07:00:00 GMT",Google News,
Databricks and NVIDIA: Building for the Agentic Era - Databricks,https://news.google.com/rss/articles/CBMif0FVX3lxTE0xUXJpQWd0WW50MmN2cDllX2h1alVzVE1WWFlyUlJtMlZqbmtrbG0wVVVwZnRMcUZPYy0zMHlRT2x4S2hJSmV5YjE4Tldka3AwY2RCYWFkcUxuMy1ZM0FRTkRMRkZDRnU4MmxjOXhsdmJlSTdXLUljUEFYUUU0Z2c?oc=5,"Wed, 17 Jun 2026 20:17:34 GMT",Google News,
Amazon in Talks to Sell Custom AI Chips in Bid to Undercut Nvidia - Bloomberg.com,https://news.google.com/rss/articles/CBMitgFBVV95cUxQU3VCZ1BuMy1ydHA5U0xMbUZIdEUzZDh0dXozVVBRSlJSbHFyWHFtQmVPbWFaeVhXODlMamhmLVJvZ2JmWlBoSzdWTnJfZFlzbU9jNFpqSHVYOU9Xd3h5RFIta2syS2F5d281TV9WNjRCV3EyMzdGY2x2eUozNkxvbFFqYWxWTzMtSWlpdlEwa3VUWWlaTWJfT2VyNC1zQjlLNmNSbGNvZlVfUk5TN2pVQThHajkwUQ?oc=5,"Thu, 18 Jun 2026 15:06:06 GMT",Google News,
"How FERC’s Large-Load Interconnection Actions Help Address Grid Stress, Improve Affordability - NVIDIA Blog",https://news.google.com/rss/articles/CBMib0FVX3lxTE9kUWF2eTFNWm1lV1Q0MVRnNXBhUHp6Z0dEYkplYXVFWTR2cVo1NmxlQlNCMDIzNjRiOW9wYW5aeXlnRUs1bGxHVjhoeG5YMlkxaWh1Z2czWmVFelRJaGNVdF9KY3lmT2t0WHowWGFSUQ?oc=5,"Thu, 18 Jun 2026 20:04:11 GMT",Google News,
"Analyst Warns Intel Valuation ‘Doesn’t Make Sense.’ Suggests NVIDIA, AMD, Micron, and Broadcom as Alternatives. - Yahoo Finance",https://news.google.com/rss/articles/CBMiogFBVV95cUxNUWpMdEJpT21FR3FiblFsSWRFcFVvRFZpWHA4SDlaLXA1NTA4UlIwZldla0lGTlJTZDhoMTVieFVqa0h1Sjd2NktoQ1ZFNl8zaGh4VkNUOUhLUDU1ajkzREljYnZOZVhJWldGbVc2ejJaR3RFRjZOSmhqcTloYy1UYUtxOVRzY3dZY3JPMWMwU3hHemMxUW83N0xfMTM4RjNhYWc?oc=5,"Fri, 19 Jun 2026 17:36:48 GMT",Google News,
Michael Burry Called the 2008 Crash. Now He's Shorting Nvidia to Buy This Boring Healthcare Stock. - 24/7 Wall St.,https://news.google.com/rss/articles/CBMi1gFBVV95cUxPT1IwMWRpT0QzUHh6M25hN0Jvd09NS0loWW9OSjk1Um85VTNkSkVZMVc3bWNpWXRZWmlUTTFuM1RDbG92d3B4YThmN0Q5VWE2ZlFZQ0llZzlmcHExV0N6elVvdVVJU2VwNlZsSjJDSGNhMk1mbEhGb3J6SWRJV0VjQV9ONExvYnRnbUJRVmhSZC1pSXhfUGFoMmxpRTdCMVpGRV85RG5rTWJhZllPTlZXY0tXNzRvU0Z4cXZxck5PTEFaVDhhMzZoMEtFM0VxZ1dKMUo3UlFB?oc=5,"Thu, 18 Jun 2026 15:29:34 GMT",Google News,
Microsoft vs. Nvidia: Which AI Giant Is the Better Dividend Stock for the Long Haul? - Barchart.com,https://news.google.com/rss/articles/CBMiwwFBVV95cUxQbzU1OC1lczN3U09fQ3d5eE1nSFd4OGJpRldUd1g0d0w2dW5mRkk2T0NOYm5mRFZISm9icVhESGV0OFhjSFZabU82czlVbDdMZXJMUS1BME5TQ0l2ZWw0M0xkMzVTWi1SbVVQcURTdDhxRjBFSnBfZkViUHVaMVQ0Qm9qU1pOaFhFZFNqNjRlZmprS0lUY2VreG9lVUNWLW1Sdkk3dm5FRS1JX2hZcDhTc2lScnZKVXlIZVltRGlaQXlETVE?oc=5,"Fri, 19 Jun 2026 23:00:02 GMT",Google News,
How NVIDIA (NVDA) Is Extending Its AI Infrastructure Reach Into XR and Physical AI - Yahoo Finance,https://news.google.com/rss/articles/CBMipgFBVV95cUxNUVQ0YTB5YUhrRWQtb2VkbTdEVG1FYUp4QWc1aV9Ja3lEOUQweGlPZXJMS2U4WVp6UVQ1ZEp2STNPcUw1M1ZUSWZMNkZDS0JqODdEdEZNWWdLZ0V6M0JxRGJNNjBBSFRTTFVjOE9Cdy12bTFPX1lnNjZtSzBDMHRnczJRRmdBdlFILU0yemllVm5PWmxFRzlwUWJsend3THlGd1dTZ3VR?oc=5,"Fri, 19 Jun 2026 14:34:44 GMT",Google News,
Nvidia to raise $25 billion in first corporate bond sale in five years - Reuters,https://news.google.com/rss/articles/CBMiyAFBVV95cUxOb3J6OUR4dG9YbWJEWmwzYkQ1SVpMOHFiQU9PMmYweDJ6N0R0dUhmNmt6THBkdlFxMHhUcDA1OFFwSktsNUQ4c3N2WW9ZU0J1YTZHYk95RVc0c25mV3Bqd0kyVEJNMUQ1U2FvSUt4Z1N2a1BMTXJJRHRyWnJRV2J4cGY4NktrTVgzdHVQWXBGZ3hDSnAzb3RJR0FWUXRjUEdkejJXMTh3dWhINWFrQ3RtMmxINTVrOERqVGctZXJCVF9RRDd2OEtWdg?oc=5,"Mon, 15 Jun 2026 22:11:12 GMT",Google News,
"NVIDIA CEO Jensen Huang on AI Stock Dips: “Everybody Should Be Very Excited to Buy Stock at a Cheaper Price"" — These Stocks are on My Radar After a Worrisome Wednesday - 24/7 Wall St.",https://news.google.com/rss/articles/CBMiqgJBVV95cUxNRHNpQXhtbVltVVhMcHIyb1FFa05UYzRIZU9rcWc3bEJNczJCV0h6R3N0NzZYaG1fVk1Pb0tVbVRxQ1RubG1aWlh6dldKWUdWcUxwY29LaHNBejBvLWdTRU15MUh3VEprdXA3clVOZGEydHJEWUlKZGI0TVFnVFRxM0FLbFV0eHZSYXJGWWV4VFpTY0Z1U3V0N1BwS1hDZlNHN0dXMF9EZVlfR1BjZV93TmZnRnF3T1F4UnU5cVJJV2tmOFlXT01jWGhwMXRWQ1VQTjhMYXhXSVdFbzlkT0YzQ2RJbU15MzNValRhVEMxNS1YOU9KY1h0ZW1wTGt5TkdldmRiQWtiRFktMDFGOTZYZVdvU0N5TV94SUZxenQ2MzVfRnk1RTM0cjBn?oc=5,"Thu, 18 Jun 2026 11:05:51 GMT",Google News,
NVIDIA GeForce GTX 1650 modded with 8GB of GDDR6 memory doubles performance in God of War and Unigine Superposition - TweakTown,https://news.google.com/rss/articles/CBMi9wFBVV95cUxPUUxpVV9tSGhxaDZUMEsyVmh5RUtuTS1MRzE5NEFVT1lzOGNjd0sxOGtQUklSZjk0OG9rZHhGNFVhV0hGS0g0dlhTUjg1MHNWNlY5ZGJSby1BQmV0Vm1fRUw0VlA0WUx5NE9LNEhQaDl0UWtwOFJkbldFY0U4NG9GWDN3alY4VWxFZEhkSTgtWDhjdmIxOHhYOTZlVFVMNjg5WjV6c05KajM3VXBPd0hDS0w5VlhVUW5BRUVNUnZpLWtqdWNwdkpTbnZ3ZkNOamZRVkNxbnoydkc2Q29LdUs2bWpVekcweHk4TnFfVWZ3R1pMRUFvbXNn?oc=5,"Thu, 18 Jun 2026 21:17:06 GMT",Google News,
"NVIDIA and LG Group Build an AI Factory to Advance Physical AI, Mobility and AI Infrastructure - NVIDIA Blog",https://news.google.com/rss/articles/CBMibkFVX3lxTE1WZWJQbW5PdHZoZmNCbExjaVVXX25PcVlWNWlEcmMwSU9YakFyNDRoVXNRTm1tZUdIeThxaEJjMmR2NHl5TnFHbHhla2ctWGVfQldZREsxWEVYNFZCSDFLbVlONEM5dVZvVzl3czBn?oc=5,"Sun, 07 Jun 2026 07:00:00 GMT",Google News,
Agentic AI And The Next Layer Of The Trade: Beyond Nvidia - Forbes,https://news.google.com/rss/articles/CBMirgFBVV95cUxNQnF5QTYzRERUYTB1MmprUGx2UkdhUlNYdkNnNU5zbkR5Z0FJaHp3QTVfNHI0aGNqZGFzV19fS3ViY1pHeDhseTlSVTVCazZ0V2NhVXhQYy1EOWhidUItT2Y1dy1LeDNaZE1wai1ITlplNVRTMVhXRVNPNTI3Mnc0SmJHN1lUZEkwQ1lWSmI3b2NzLXdSeWpkUFhaM2ZGTVlCMkh2UUo5Q01jbmcyM2c?oc=5,"Sat, 20 Jun 2026 04:31:00 GMT",Google News,
Nvidia Joins AI Borrowing Frenzy With $25 Billion Bond Sale - Bloomberg.com,https://news.google.com/rss/articles/CBMirgFBVV95cUxNWWtpZEVJNkNXV3o3NGNkMVdSenh0X2J0dFZhZUJYLUJqUjVHQ0ZpYk9UbWpCMFpNVkpiM0ZyMUFyLWRfR2p2bnRUc0RaVGM2azQxNzFGb2VHeVIzS0lJVE83NHU2QmRFcmNheUFkUWJ5WDBKQzM3aWYydTNTYTc3OE5RQ0Z6RmZWR1U4Z192MXY2c0F0dEp5ZmFPNWc1TC1NU0VCVHdXNUljSklVdUE?oc=5,"Mon, 15 Jun 2026 20:49:18 GMT",Google News,
NVIDIA and Microsoft Reinvent Windows PCs for the Age of Personal AI - NVIDIA Newsroom,https://news.google.com/rss/articles/CBMihwFBVV95cUxOQ2syWGhmZU10YXdaWk9vWlpoaWlsOXp3SGg3TXZFdEFyQm9waHZfOUFIOVAtenNFM1RJTk84cXFEOU1ZNzNMZ0VVNm5vX1pPSE0zMlU4bTZRcTNtNmNTZERHR1hCbVNFM2tFNC01Z2ZTeF9qVmppa2p0clNWRUV4b1ZWck9wMUE?oc=5,"Sun, 31 May 2026 07:00:00 GMT",Google News,
US awards $500 million to Nvidia-backed SandboxAQ for finding new chipmaking materials - Reuters,https://news.google.com/rss/articles/CBMiwwFBVV95cUxNdk4xYlJEQzhuS1ZNa3dQRHhibDlrS3VuV0pqTEdZNGRSVE43SjdIaHBaVjZlMnEzaWY5UmhNamNkWlF3T3NoR1pPY1RFcHVzU0xUQ2I2SzhyTHJTWUZJMl9abG5KclAzd0JXRHJ2Z2laV2drcHdKbzRQNlZ6RmhESG45QzRFRUg5ekhtYjhYRVVFMzZKQldxYXozTmtBb3NDRXVlaWZNU1VEQTVITkxxcEdCd1ZIOWd4SkNVQ3YyTFdQSjA?oc=5,"Wed, 17 Jun 2026 11:24:11 GMT",Google News,
"1 Unstoppable Stock to Buy Before it Soars 848% to Join Nvidia in the $5 Trillion Club, According to 1 Wall Street Analyst - The Motley Fool",https://news.google.com/rss/articles/CBMi-AFBVV95cUxPNFcwTXdobE5PdktwbHZ0UDg2Ynk0UzVmNlVITWZOd1h6aUpDXzJzQTQ1bkFrVWJnb0xNTG0xaWZNR1RVRFlrdkRhMGdNUEVRSWRyYkhHLUhyMHVuRkFTN0NudzNOZi1XVVlvUEtJN2cxVDlKSlZCNVlPa3NnS1dmRS1hZ1hvTnJsUm9JSDBxSE5qOTJ4U3VITlY1Vm85aGhHcGdMT2dGSTVqaWdQdm5CT0FpbjcxY2x3VDdvdTl0MHBRanNoWlVpYXlYQ0paVm51Wl9rajQ2SDVfeWtxdE5IcjVyUG5aTFFiMkpOTXhkMi14cV9EZUdJOQ?oc=5,"Wed, 17 Jun 2026 19:01:00 GMT",Google News,
AP Exclusive: Nvidia’s Jensen Huang says society needs ‘new social norms’ in the age of AI - AP News,https://news.google.com/rss/articles/CBMinAFBVV95cUxOTHJEWURVbXBpUTM4S28zR3NTNEVpRndlM3hSdUMzRURzb004bEVrcHlUTC1aMWVhUmxPT3hUVEFhR1B4NUY3VEJqT29wMzdOSUZRQUQyRXgtZUxTSEoteXAyR0Y3S2sxa2FFOWphMjRFbzBqUHZnbEZvNXFOMEkya2RzZGo3dmtWaVc1eDFrSkN2MGpNWXJZUFlOa3I?oc=5,"Wed, 17 Jun 2026 01:37:00 GMT",Google News,
Key facts: NVIDIA speeds AI chip cycles; prices $25B bonds - TradingView,https://news.google.com/rss/articles/CBMiuAFBVV95cUxPY3FENXZxRlVHaDE1ZGNSVE0tVmpabDlySDF0Q3MwOVlvSUlFSjBEb3BBZk43bFhQcTh2S1Vrb3JScGpNallMeDU5MlZCMjdzS0x1clpfRXpOd2JXT0FyOGI1UE1sNHFiWkVrbE1ndmswZGtqMVQ1WW5rVlZRZGZDd2I1N0JuU0ptQ2lsSV9KUHFudU1SbkxvUWFCREYtbVVscDcySXVtMnY3ZUxSX2J6WFRGQkhqQmFu?oc=5,"Sat, 20 Jun 2026 07:13:07 GMT",Google News,
The AI trade could shift back in Nvidia's favor. Here's why - CNBC,https://news.google.com/rss/articles/CBMimAFBVV95cUxORWhEdEFCaDFleU9yV1poUDBrZ2V3NUlMeFZsVTFKdE9tMndPaEpBbS1lSFJFYWZJNnBJNGxNSzl6ZU9aZ0pTUldvakZoUXZyaW96aUQ3U2k2UUpNTDRaZXFnbnpxQ3ppSld1aFN4d0dId3BuZEhESTlLenhBZGpXYTlqS2pTQ0taVXMyaXFqVHcxWTU2Nmp5Sg?oc=5,"Thu, 18 Jun 2026 17:27:01 GMT",Google News,
Nvidia supplier SK Hynix ships samples of next-generation chips to major customers - Reuters,https://news.google.com/rss/articles/CBMixwFBVV95cUxQSXlVdU03T1c5aXI0R1hUWW1EQmFNYm9kZ1d2dkxoSldlOHk3QnktcHlNWk44V0dEQVAxU0FQeExhWlc4Z3NmcXdZcVd4cVpnODZSTEE2Y0JuSHMzTmxwY0tVYmxVWF9lRjlXMVlndXlqWDlKOFlXc1ZuZDFfdGNzcUJkMWRMU2FRaWU5Um9lNXlxUjgyb2FTc1hKR0RadTNaVWZGU3QzN0EtVTZxMUk1Q2dXVU02cmxwWUVXR0ZJNTAxRDlKMmFJ?oc=5,"Wed, 17 Jun 2026 23:49:48 GMT",Google News,
